{
  "$schema": "http://json-schema.org/draft-07/schema#",
  "$id": "https://keyvalue.systems/sdlc/tasks.schema.json",
  "title": "SDLC tasks.json — parallel task DAG",
  "type": "object",
  "additionalProperties": false,
  "required": ["schema_version", "stack", "feature_slug", "context_manifest", "slices", "tasks"],
  "properties": {
    "schema_version": { "const": 1 },
    "stack": { "enum": ["backend", "frontend", "qa"] },
    "feature_slug": { "type": "string", "minLength": 1 },
    "context_manifest": {
      "type": "object",
      "additionalProperties": false,
      "required": ["read_once", "reference"],
      "properties": {
        "read_once": { "type": "array", "items": { "type": "string", "minLength": 1 } },
        "reference": { "type": "array", "items": { "type": "string", "minLength": 1 } }
      }
    },
    "slices": {
      "type": "array",
      "minItems": 1,
      "items": {
        "type": "object",
        "additionalProperties": false,
        "required": ["group_id", "task_ids"],
        "properties": {
          "group_id": { "type": "string", "minLength": 1 },
          "task_ids": { "type": "array", "minItems": 1, "items": { "type": "string", "minLength": 1 } }
        }
      }
    },
    "tasks": {
      "type": "array",
      "minItems": 1,
      "items": {
        "type": "object",
        "additionalProperties": false,
        "required": ["id", "group_id", "title", "depends_on", "reads", "writes", "test", "standards", "needs_human_gate"],
        "properties": {
          "id": { "type": "string", "minLength": 1 },
          "group_id": { "type": "string", "minLength": 1 },
          "title": { "type": "string", "minLength": 1 },
          "depends_on": { "type": "array", "items": { "type": "string", "minLength": 1 } },
          "reads": { "type": "array", "items": { "type": "string", "minLength": 1 } },
          "writes": { "type": "array", "minItems": 1, "items": { "type": "string", "minLength": 1 } },
          "test": { "type": "string", "minLength": 1 },
          "standards": { "type": "array", "items": { "type": "string" } },
          "needs_human_gate": { "type": "boolean" }
        }
      }
    }
  }
}
